{
  "$schema": "https://json-schema.org/draft/2020-12/schema",
  "$id": "https://raw.githubusercontent.com/PapathanasiouIoannis/EoS-generation/main/configs/schema.json",
  "title": "BSk24 / BSk25 experiment settings",
  "description": "Public settings for controlled BSk24 or BSk25 sound-speed deformation experiments. Runtime semantic validation remains authoritative.",
  "type": "object",
  "additionalProperties": false,
  "required": [
    "$schema",
    "amplitudes",
    "epsilon_match",
    "center",
    "width",
    "ramp_width",
    "calculation",
    "precision",
    "fixed_masses",
    "diagnostics"
  ],
  "$defs": {
    "positiveNumber": {
      "type": "number",
      "exclusiveMinimum": 0
    },
    "positiveScalarOrArray": {
      "oneOf": [
        {
          "$ref": "#/$defs/positiveNumber"
        },
        {
          "type": "array",
          "minItems": 1,
          "maxItems": 256,
          "items": {
            "$ref": "#/$defs/positiveNumber"
          }
        }
      ]
    }
  },
  "properties": {
    "$schema": {
      "type": "string",
      "minLength": 1,
      "description": "Required editor annotation; it is removed before scientific settings are normalized and hashed."
    },
    "matter_model": {
      "type": "string",
      "enum": [
        "bsk24",
        "bsk25"
      ],
      "default": "bsk24",
      "description": "Analytical baseline: bsk24 (default) or bsk25, from Pearson 2018 corrected 2019. BSk25 follows paper Table C1 p8=2.54; see docs/bsk25-validation.md."
    },
    "amplitudes": {
      "type": "array",
      "minItems": 1,
      "maxItems": 4096,
      "items": {
        "type": "number"
      },
      "description": "Finite additive amplitudes applied to dimensionless c_s^2. A logical zero-amplitude identity case is added per geometry when absent; one deterministic geometry owns the shared physical baseline execution.",
      "x-unit": "dimensionless"
    },
    "epsilon_match": {
      "oneOf": [
        {
          "const": "standard"
        },
        {
          "type": "number",
          "exclusiveMinimum": 76.5591451931,
          "exclusiveMaximum": 1508.9793344234
        }
      ],
      "description": "Standard BSk24 reconstruction anchor or a governed total-energy-density anchor.",
      "x-unit": "MeV fm^-3 when numeric"
    },
    "center": {
      "$ref": "#/$defs/positiveScalarOrArray",
      "description": "Gaussian center or centers in total energy density.",
      "x-unit": "MeV fm^-3"
    },
    "width": {
      "$ref": "#/$defs/positiveScalarOrArray",
      "description": "Gaussian standard deviation or deviations in total energy density.",
      "x-unit": "MeV fm^-3"
    },
    "ramp_width": {
      "$ref": "#/$defs/positiveScalarOrArray",
      "description": "Width or widths of the quintic smootherstep rise from the reconstruction anchor.",
      "x-unit": "MeV fm^-3"
    },
    "calculation": {
      "type": "string",
      "enum": [
        "thermodynamics",
        "stellar"
      ],
      "description": "Run thermodynamic construction only, or include the governed background, fixed-mass, and tidal stellar calculations."
    },
    "precision": {
      "type": "string",
      "enum": [
        "quick",
        "strict",
        "dataset",
        "dataset_10_tighter",
        "dataset_20",
        "dataset_40",
        "dataset_40_curves",
        "dataset_relaxed",
        "dataset_relaxed_80"
      ],
      "description": "Named governed numerical profile. The expanded internal settings are planned, hashed, and saved."
    },
    "fixed_masses": {
      "type": "array",
      "minItems": 1,
      "maxItems": 32,
      "items": {
        "type": "number",
        "exclusiveMinimum": 0,
        "exclusiveMaximum": 10
      },
      "description": "Requested fixed gravitational masses for stellar calculations.",
      "x-unit": "solar masses"
    },
    "diagnostics": {
      "type": "string",
      "enum": [
        "off",
        "on"
      ],
      "description": "When on, retain the governed endpoint extended stellar diagnostics."
    },
    "observables": {
      "type": "array",
      "uniqueItems": true,
      "items": {
        "enum": [
          "sequence",
          "fixed_mass",
          "maximum_mass"
        ]
      },
      "description": "Optional explicit stellar products. Sequence is required for stellar work. Omission preserves the historical profile defaults."
    }
  },
  "allOf": [
    {
      "if": {
        "properties": {
          "diagnostics": {
            "const": "on"
          }
        },
        "required": [
          "diagnostics"
        ]
      },
      "then": {
        "properties": {
          "calculation": {
            "const": "stellar"
          }
        }
      }
    },
    {
      "if": {
        "properties": {
          "calculation": {
            "const": "thermodynamics"
          }
        },
        "required": [
          "calculation"
        ]
      },
      "then": {
        "properties": {
          "observables": {
            "maxItems": 0
          }
        }
      }
    },
    {
      "if": {
        "properties": {
          "calculation": {
            "const": "stellar"
          }
        },
        "required": [
          "calculation"
        ]
      },
      "then": {
        "properties": {
          "observables": {
            "contains": {
              "const": "sequence"
            }
          }
        }
      }
    },
    {
      "if": {
        "properties": {
          "diagnostics": {
            "const": "on"
          }
        },
        "required": [
          "diagnostics"
        ]
      },
      "then": {
        "properties": {
          "observables": {
            "contains": {
              "const": "fixed_mass"
            }
          }
        }
      }
    },
    {
      "if": {
        "properties": {
          "diagnostics": {
            "const": "on"
          },
          "precision": {
            "const": "dataset_40_curves"
          }
        },
        "required": [
          "diagnostics",
          "precision"
        ]
      },
      "then": {
        "required": [
          "observables"
        ]
      }
    }
  ]
}
