{
  "$schema": "./schema.json",
  "amplitudes": [
    0.0,
    0.01,
    -0.01,
    0.025,
    -0.025,
    0.05,
    -0.05
  ],
  "epsilon_match": "standard",
  "center": 200.0,
  "width": 50.0,
  "ramp_width": [
    30.0,
    40.0,
    45.0
  ],
  "calculation": "thermodynamics",
  "precision": "strict",
  "fixed_masses": [
    1.4
  ],
  "diagnostics": "off"
}
